{
  "schema": "uads.cost-ledger",
  "schemaVersion": "0.6.0",
  "projectId": "58233072c1c707ff",
  "workOrderId": null,
  "executionRunId": null,
  "estimatedContextTokens": 0,
  "estimatedDiagnosticTokens": 0,
  "contextExpansions": 0,
  "c5Uses": 0,
  "toolExecutions": 0,
  "gateExecutions": 0,
  "gateCacheHits": 0,
  "gateCacheMisses": 0,
  "evidenceReuseCount": 0,
  "avoidedToolExecutions": 0,
  "fullRepositoryScans": 1,
  "agentCallsReported": null,
  "modelCapabilityClass": null,
  "softBudget": null,
  "hardBudget": null,
  "budgetStatus": "ok",
  "tokenEstimateMethod": "byte-heuristic",
  "updatedAt": "2026-09-09T15:13:11.153Z"
}
