{
  "schema": "uads.cost-ledger",
  "schemaVersion": "0.6.0",
  "projectId": "8e4b5bd6a6c41b50",
  "workOrderId": "wo_1a9bd8e2df2692e3",
  "executionRunId": "er_47cc270c0ac2aee5",
  "estimatedContextTokens": 6,
  "estimatedDiagnosticTokens": 0,
  "contextExpansions": 0,
  "c5Uses": 0,
  "toolExecutions": 6,
  "gateExecutions": 6,
  "gateCacheHits": 0,
  "gateCacheMisses": 6,
  "evidenceReuseCount": 0,
  "avoidedToolExecutions": 0,
  "fullRepositoryScans": 1,
  "agentCallsReported": null,
  "modelCapabilityClass": "economy",
  "softBudget": 8000,
  "hardBudget": 16000,
  "budgetStatus": "ok",
  "tokenEstimateMethod": "byte-heuristic",
  "updatedAt": "2026-09-09T15:15:08.519Z"
}
